[
  {
    "name": "fleet",
    "description": "Turn prompts into queued tasks for Thurbox workers and follow them on a full-screen Kanban board.",
    "author": "Thurbeen",
    "badge": "official",
    "repo": "https://github.com/Thurbeen/fleet",
    "kind": "extension",
    "platforms": [
      "Linux",
      "Windows (native)"
    ],
    "updated": "2026-10-07",
    "install": "curl -LsSf https://raw.githubusercontent.com/Thurbeen/fleet/main/install.sh | sh",
    "notes": "Requires Thurbox, tmux (psmux on Windows), git and an agent CLI. On Windows, install from PowerShell with irm https://raw.githubusercontent.com/Thurbeen/fleet/main/install.ps1 | iex. Start Mission Control and run /fleet-onboarding to install the Kanban dashboard. Alt+K opens the board; the legacy queue pane is optional.",
    "media": {
      "url": "https://raw.githubusercontent.com/Thurbeen/fleet/main/media/fleet-board.gif",
      "alt": "Fleet Kanban board with six task columns, topic filters and optional fuel gauges."
    }
  },
  {
    "name": "thurbox-info-panel",
    "description": "Session, git, agent, account quota and system readouts beside your terminal.",
    "author": "Thurbeen",
    "badge": "official",
    "repo": "https://github.com/Thurbeen/thurbox-info-panel",
    "kind": "pane",
    "platforms": ["Linux", "macOS", "Windows (pane; metrics depend on host)"],
    "updated": "2026-10-07",
    "install": "thurbox-cli plugin install git+https://github.com/Thurbeen/thurbox-info-panel",
    "notes": "Requires Thurbox \u2265 2.51.7. Add the info slot to layout.lua, then press F2. Account quotas need quota-axi \u2265 0.1.58 and a run grant; install the optional refresh extension from the cloned plugin directory. See README for setup.",
    "media": {
      "url": "https://raw.githubusercontent.com/Thurbeen/thurbox-info-panel/main/media/demo.gif",
      "alt": "Info panel in the Thurbox interface"
    }
  },
  {
    "name": "thurbox-auto-continue",
    "description": "Resume Claude sessions once their usage window resets.",
    "author": "Thurbeen",
    "badge": "official",
    "repo": "https://github.com/Thurbeen/thurbox-auto-continue",
    "kind": "extension",
    "platforms": ["Linux", "macOS", "WSL (install on each host)"],
    "updated": "2026-09-30",
    "install": "git clone https://github.com/Thurbeen/thurbox-auto-continue\ncd thurbox-auto-continue\n./install.sh",
    "notes": "Requires cargo or a prebuilt binary, Claude Code and Thurbox \u2265 2.36.2. Off by default. Follow the README to install both optional panes and grant run. Native Windows unsupported.",
    "media": {
      "url": "https://raw.githubusercontent.com/Thurbeen/thurbox-auto-continue/main/media/demo.gif",
      "alt": "Auto continue in the Thurbox interface"
    }
  },
  {
    "name": "thurbox-code-review",
    "description": "Review worktree diffs and send numbered notes to your agent.",
    "author": "Thurbeen",
    "badge": "official",
    "repo": "https://github.com/Thurbeen/thurbox-code-review",
    "kind": "pane",
    "platforms": [
      "Linux",
      "macOS",
      "Windows (Lua pane; optional shell commands need a POSIX shell)"
    ],
    "updated": "2026-09-27",
    "install": "thurbox-cli plugin install git+https://github.com/Thurbeen/thurbox-code-review",
    "notes": "Requires Thurbox \u2265 2.35.0. Replaces the bundled agent pane; follow README setup and capability grants. Cannot combine with the thurbox-files agent pane fork.",
    "media": {
      "url": "https://raw.githubusercontent.com/Thurbeen/thurbox-code-review/main/media/demo.gif",
      "alt": "Code review in the Thurbox interface"
    }
  },
  {
    "name": "thurbox-doom",
    "description": "Play DOOM in an agent-pane tab, with a bundled engine and WADs.",
    "author": "Thurbeen",
    "badge": "official",
    "repo": "https://github.com/Thurbeen/thurbox-doom",
    "kind": "pane",
    "platforms": ["Linux x86_64 (bundled engine)", "Other platforms (bring or build an engine)"],
    "updated": "2026-10-02",
    "install": "thurbox-cli plugin install git+https://github.com/Thurbeen/thurbox-doom",
    "notes": "Install code-review for the integrated Doom tab, then grant its agent pane program. F5 opens Doom. GIF shows the earlier standalone pane; README documents current setup.",
    "media": {
      "url": "https://raw.githubusercontent.com/Thurbeen/thurbox-doom/main/media/demo.gif",
      "alt": "Doom in the Thurbox interface"
    }
  },
  {
    "name": "thurbox-automations",
    "description": "Manage automations and read their recent runs: create, edit, duplicate, switch on and off, run now and delete.",
    "author": "Thurbeen",
    "badge": "official",
    "repo": "https://github.com/Thurbeen/thurbox-automations",
    "kind": "pane",
    "platforms": ["Linux", "Windows (native)", "macOS (untested)"],
    "updated": "2026-10-11",
    "install": "thurbox-cli plugin install git+https://github.com/Thurbeen/thurbox-automations",
    "notes": "Requires Thurbox \u2265 2.56.5; creating, editing and duplicating need \u2265 2.57.0. No layout.lua edit. Alt+A opens it. Trust the pane (run) only to write exec automations' commands. Run history is the 10 most recent runs, and an exec run keeps only its output tail.",
    "media": {
      "url": "https://raw.githubusercontent.com/Thurbeen/thurbox-automations/main/media/demo.gif",
      "alt": "The automations pane in the Doom theme: the list, a failed run's output filtered to errors, run now, an automation switched off and a delete confirmed"
    }
  },
  {
    "name": "thurbox-voice",
    "description": "Dictate a prompt into the selected session with Ctrl+Space. Speech is transcribed on your machine, and the text waits unsent.",
    "author": "TMSCH",
    "badge": "community",
    "repo": "https://github.com/TMSCH/thurbox-voice",
    "kind": "pane",
    "platforms": ["Linux", "macOS"],
    "updated": "2026-10-09",
    "install": "git clone https://github.com/TMSCH/thurbox-voice && cd thurbox-voice\ncargo install --locked --path crates/thurbox-voice\nthurbox-voice pull parakeet\nthurbox-cli plugin install git+https://github.com/TMSCH/thurbox-voice\nthurbox-cli plugin check",
    "notes": "Requires Thurbox ≥ 2.56.0, Rust and cmake; Linux also needs pkg-config and ALSA headers. Trust the voice pane to run its helper. Audio stays local. An optional cleanup pass, on by default, sends the transcript and session context to a language model, hosted unless you point it at a local server. See README.",
    "media": {
      "url": "https://raw.githubusercontent.com/TMSCH/thurbox-voice/main/media/demo.gif",
      "alt": "Dictating into a Thurbox session: Ctrl+Space, speak, Ctrl+Space, and the text waits in the input box"
    }
  },
  {
    "name": "thurbox-files",
    "description": "Browse files and changes, with editor and diff tabs beside the agent.",
    "author": "spscream",
    "badge": "community",
    "repo": "https://github.com/spscream/thurbox-files",
    "kind": "pane",
    "platforms": [
      "Linux (documented setup)",
      "Other platforms (POSIX tools and nvim required; unverified)"
    ],
    "updated": "2026-09-24",
    "install": "thurbox-cli plugin install git+https://github.com/spscream/thurbox-files --as plugins/90_files.lua\nthurbox-cli plugin install git+https://github.com/spscream/thurbox-files --as plugins/95_files_menu.lua\nthurbox-cli plugin install git+https://github.com/spscream/thurbox-files --as plugins/20_agent.lua",
    "notes": "Follow the README to replace the bundled agent pane, place the files slot in layout.lua and grant capabilities. Requires nvim. Conflicts with the code-review agent pane fork.",
    "media": {
      "url": "https://raw.githubusercontent.com/spscream/thurbox-files/main/media/demo.gif",
      "alt": "Files in the Thurbox interface"
    }
  },
  {
    "name": "thurbox-annotate",
    "description": "Annotate captured agent output, or collect notes on a live selection.",
    "author": "spscream",
    "badge": "community",
    "repo": "https://github.com/spscream/thurbox-annotate",
    "kind": "pane",
    "platforms": [
      "Linux",
      "macOS",
      "Windows / WSL (Lite clipboard support; Full requires POSIX scripts)"
    ],
    "updated": "2026-09-17",
    "install": "thurbox-cli plugin install git+https://github.com/spscream/thurbox-annotate --as plugins/41_notes.lua",
    "notes": "Shown command installs Lite; requires Thurbox \u2265 2.25.0. Grant run for agent clipboard selection. Full uses plannotator-tui and the program capability; see README for its installer. F2 opens Lite; GIF shows Full.",
    "media": {
      "url": "https://raw.githubusercontent.com/spscream/thurbox-annotate/main/media/demo.gif",
      "alt": "Annotate in the Thurbox interface"
    }
  }
]
